table_name,column_name,database_type,base_type,comment,,
OPDDCTPRSC,nomed,numeric,type/Decimal,"1=สถานะไม่จ่ายยา,2=off ยา,3=เปลี่ยนยา",,
OPDDCTPRSC,nomednote,varchar,type/Text,รายละเอียดไม่จ่ายยา,,
OPDDCTPRSC,nomedstf,numeric,type/Decimal,รหัสผู้ไม่จ่ายยา,,
OPDDCTPRSC,nomeddate,timestamp,type/DateTime,วันที่ไม่จ่ายยา,,
OPDDCTPRSC,nomedtime,numeric,type/Decimal,เวลาไม่จ่ายยา,,
OPDDCTPRSC,phmotpqty,numeric,type/Decimal,จำนวนที่ห้องจ่ายยาจ่าย,,
OPDDCTPRSC,remainqty,numeric,type/Decimal,จำนวนที่ห้องจ่ายยาออกใบค้างยา,,
OPDDCTPRSC,splitqty,numeric,type/Decimal,จำนวนที่ห้องจ่ายยาออกใบแยกซื้อ,,
OPDDCTPRSC,phmnote,numeric,type/Decimal,รายละเอียดที่ห้องจ่ายยาต้องการสื่อสารกับแพทย์,,
OPDDCTPRSC,medduetype,numeric,type/Decimal,รหัสประเภท DUE,,
OPDDCTPRSC,duechk,numeric,type/Decimal,"สถานะมีใบ DUE หรือไม่; 0 หรือ null ไม่มี; 1: มี""",,
OPDDCTPRSC,medunitsale,numeric,type/Decimal,หน่วยขาย,,
OPDDCTPRSC,ordextm,numeric,type/Decimal,1: สั่งทำ Extemporaneous; 0 หรือ null ไม่ได้สั่ง,,
OPDDCTPRSC,ordextmtime,numeric,type/Decimal,เวลาที่สั่งทำ Extemporaneous,,
OPDDCTPRSC,nursenote,varchar,type/Text,รายละเอียด,,
OPDDCTPRSC,split,numeric,type/Decimal,1=แบ่งใบสั่งยา,,
OPDDCTPRSC,ptdate,timestamp,type/DateTime,วันที่ผู้ป่วย,,
OPDDCTPRSC,pttime,numeric,type/Decimal,เวลาผู้ป่วย,,
OPDDCTPRSC,ptst,numeric,type/Decimal,สถานะผู้ป่วย,,
OPDDCTPRSC,meditemnew,numeric,type/Decimal,รหัสรายการยาที่เปลี่ยน,,
OPDDCTPRSC,packseqnew,numeric,type/Decimal,ลำดับ Packseq ที่เปลี่ยน,,
OPDDCTPRSC,itemnonew,numeric,type/Decimal,ลำดับที่การสั่งที่เปลี่ยน,,
OPDDCTPRSC,fortreat,numeric,type/Decimal,ใช้เพื่อการรักษา,,
OPDDCTPRSC,source,numeric,type/Decimal,"วิธีการเลือก (1=Key,2=ReMed,3=ReOrder,4=DrugSet,5=Favorites",,
OPDDCTPRSC,sourceno,numeric,type/Decimal,เลขที่อ้างอิงในการเลือกรายการยา,,
OPDDCTPRSC,rcvst,numeric,type/Decimal,สถานะการรับคำสั่ง 1: รับแล้ว; 0: ยังไม่รับ,,
OPDDCTPRSC,nomedst,numeric,type/Decimal,สถานะจ่ายยา 1: ไม่จ่าย; 0: จ่าย,,
OPDDCTPRSC,status,numeric,type/Decimal,สถานะการใช้งาน 1: ใช้งาน; 0: ยกเลิก,,
OPDDCTPRSC,eyecodeset,varchar,type/Text,ข้อบ่งชี้ในการฉีดยาเข้าวุ้นในตา,,
OPDDCTPRSC,eyecodesetdesc,varchar,type/Text,เหตุผลอื่นๆ ในการฉีดยาเข้าวุ้นในตา,,
OPDDCTPRSC,eyecodesetchg,varchar,type/Text,ข้อบ่งชี้ในการเปลี่ยนยาฉีดเข้าวุ้นในตา,,
OPDDCTPRSC,eyecodesetchgdesc,varchar,type/Text,เหตุผลอื่นๆ ในการเปลี่ยนยาฉีดยาเข้าวุ้นในตา,,
OPDDCTPRSC,notinphm,numeric,type/Decimal,Flag เวชภัณฑ์ไม่มีในห้องยา,,
OPDDCTPRSC,flagedit,numeric,type/Decimal,flag 1=เป็นรายการใหม่ที่เพิ่มจาก remed หรือมีการแก้ไข,,
OPPROCEDUREDCT,hn,varchar,type/Text,เลขประจำตัวผู้ป่วยนอก,,
OPPROCEDUREDCT,reqdate,timestamp,type/DateTime,วัน-เดือน-ปี SET ผ่าตัด,,
OPPROCEDUREDCT,reqtime,numeric,type/Decimal,เวลา SET ผ่าตัด,,
OPPROCEDUREDCT,itemno,numeric,type/Decimal,ลำดับ,,
OPPROCEDUREDCT,dctorder,numeric,type/Decimal,ลำดับที่แพทย์ที่ทำผ่าตัด,,
OPPROCEDUREDCT,surgstf,numeric,type/Decimal,รหัสแพทย์ผู้ทำผ่าตัด,,
OPREQVST,hn,varchar,type/Text,เลขประจำตัวผู้ป่วยนอก,,
OPREQVST,reqdate,timestamp,type/DateTime,วัน-เดือน-ปี SET ผ่าตัด,,
OPREQVST,reqtime,numeric,type/Decimal,เวลา SET ผ่าตัด,,
OPREQVST,an,varchar,type/Text,เลขประจำตัวผู้ป่วยใน,,
OPREQVST,vn,numeric,type/Decimal,เลขอ้างอิงรับการรักษา,,
OPREQVST,fn,numeric,type/Decimal,เลขอ้างอิงการรักษาต่อครั้ง,,
OPREQVST,ward,numeric,type/Decimal,รหัสหอผู้ป่วย,,
OPREQVST,cliniclct,numeric,type/Decimal,หน่วยงานส่งผ่าตัด,,
OPREQVST,deptlct,numeric,type/Decimal,รหัสภาควิชา/ฝ่าย,,
OPREQVST,subdeptlct,numeric,type/Decimal,รหัสสาขา/หน่วย,,
OPREQVST,treatline,numeric,type/Decimal,รหัสสายการตรวจ ที่ทำการผ่าตัด,,
OPREQVST,oplct,numeric,type/Decimal,รหัสหน่วยงาน/ห้องผ่าตัด,,
OPREQVST,orroom,numeric,type/Decimal,รหัสห้องผ่าตัด (OR No.),,
OPREQVST,ororder,numeric,type/Decimal,ลำดับที่เข้าผ่าตัด,,
OPREQVST,orordernew,numeric,type/Decimal,ลำดับผ่าตัดที่เปลี่ยน,,
OPREQVST,npotime,numeric,type/Decimal,เวลางดอาหาร,,
OPREQVST,calltime,numeric,type/Decimal,เวลาโทร. สอบถามผู้ป่วย,,
OPREQVST,opclinic,numeric,type/Decimal,รหัส Clinical / สภาพผู้ป่วย,,
OPREQVST,opclinicdt,varchar,type/Text,ข้อมูลเพิ่มเติม / ข้อมูลที่ติดต่อได้ (จากบันทึกจองคิวผ่าตัด),,
OPREQVST,hbp,numeric,type/Decimal,ค่าความดันโลหิตส่วนบน (Systolic : SBP),,
OPREQVST,lbp,numeric,type/Decimal,ค่าความดันโลหิตส่วนล่าง (Diastolic : DBP),,
OPREQVST,pulse,numeric,type/Decimal,ค่าอัตราการเต้นของขีพจร,,
OPREQVST,rr,numeric,type/Decimal,ค่าอัตราการหายใจ,,
OPREQVST,temp,numeric,type/Decimal,ค่าอุณหภูมิร่างกาย,,
OPREQVST,weight,numeric,type/Decimal,ค่าน้ำหนักตัว,,
OPREQVST,height,numeric,type/Decimal,ค่าความสูงของร่างกาย,,
OPREQVST,blood,numeric,type/Decimal,ค่า Blood [สำรองไว้],,
OPREQVST,via,numeric,type/Decimal,"รหัสการเข้ามาห้องผ่าตัด [Transfer to OR : - Wheelchair , - Stretcher , - Bed , - Crib , - Transformer , - Scoop , - Walk)",,
OPREQVST,anesuse,numeric,type/Decimal,"รหัสใช้บริการวิสัญญี (0 = ไม่ใช้ , 1 = ใช้)",,
OPREQVST,technique,numeric,type/Decimal,รหัสวิธีการให้บริการวิสัญญี (Anes. Technique),,
OPREQVST,aneslct,numeric,type/Decimal,รหัสหน่วยงานวิสัญญี,,
OPREQVST,reqst,numeric,type/Decimal,รหัสสถานะ SETผ่าตัด,,
OPREQVST,effecdate,timestamp,type/DateTime,วัน-เดือน-ปี บันทึกรับSETผ่าตัด/เลื่อนผ่าตัด/ ยกเลิกผ่าตัด (วันที่ยืนยัน),,
OPREQVST,effectime,numeric,type/Decimal,เวลา บันทึกรับSETผ่าตัด/เลื่อนผ่าตัด/ยกเลิกผ่าตัด (เวลายืนยัน),,
OPREQVST,effecstf,numeric,type/Decimal,รหัสเจ้าหน้าที่ผู้ยืนยัน,,
OPREQVST,effeccsgrp,numeric,type/Decimal,รหัสกลุ่มสาเหตุ ยกเลิก/เลื่อนผ่าตัด,,
OPREQVST,effeccs,numeric,type/Decimal,รหัสสาเหตุ ยกเลิก/เลื่อนผ่าตัด,,
OPREQVST,effeccsoth,varchar,type/Text,สาเหตุอื่นๆ,,
OPREQVST,estmdate,timestamp,type/DateTime,วันที่ ผ่าตัด/คาดว่าจะผ่าตัด [เป็นค่าว่างได้ %(รอน)sัดผ่าตัด(Waiting List) ],,
OPREQVST,estmtime,numeric,type/Decimal,เวลา ผ่าตัด/คาดว่าจะผ่าตัด [เป็นค่าว่างได้ %(รอน)sัดผ่าตัด(Waiting List) ],,
OPREQVST,estmstf,numeric,type/Decimal,ผู้บันทึกคาดว่าจะผ่าตัด/นัดผ่าตัด,,
OPREQVST,estmnote,varchar,type/Text,รายละเอียดการนัดผ่าตัด [สำรองไว้ก่อน],,
OPREQVST,oappcmmnt,varchar,type/Text,หมายเหตุการนัดผ่าตัด [สำรองไว้ก่อน],,
OPREQVST,ordct,numeric,type/Decimal,รหัสแพทย์เจ้าของไข้/แพทย์ที่นัดผ่าตัด,,
OPREQVST,orstf,numeric,type/Decimal,รหัสผู้รับ SETผ่าตัด,,
OPREQVST,vip,numeric,type/Decimal,"รหัส VIP (1 = VIP , NULL = Not VIP)",,
OPREQVST,ortf,numeric,type/Decimal,Add On / TF (Time Follow : เป็น Case ที่ SET เพิ่มเติมจากเวลาที่กำหนด),,
OPREQVST,overtime,numeric,type/Decimal,"ในเวลา/นอกเวลา (1 = ในเวลา , 2 = นอกเวลา , 3 = คลินิกพิเศษ)",,
OPREQVST,ortrauma,numeric,type/Decimal,"Trauma (1 = Trauma , 2 = Non Trauma)",,
OPREQVST,opsubtype,numeric,type/Decimal,"รหัสชนิดการผ่าตัด (1 = ผ่าตัดใหญ่, 2 = ผ่าตัดเล็ก, 3 = ผ่าตัดธรรมดา(กลาง), 4 = ผ่าตัดพิเศษ,  5 = ผ่าตัดอื่นๆ)",,
OPREQVST,optype,numeric,type/Decimal,"รหัสประเภทการผ่าตัด  (1 = Elective, 2 = Emergency)",,
OPREQVST,orekg,numeric,type/Decimal,ผลตรวจ EKG ประกอบไปด้วย :- ไม่มี EKG - EKG ปกติ - EKG ผิดปกติ,,
OPREQVST,ormove,numeric,type/Decimal,รหัสลักษณะการเคลื่อนย้ายผู้ป่วย,,
OPREQVST,orhiv,numeric,type/Decimal,1 = HIV,,
OPREQVST,orbearing,numeric,type/Decimal,รหัสลักษณะท่าในการผ่าตัด,,
OPREQVST,orsptool,varchar,type/Text,ชื่ออุปกรณ์พิเศษ,,
OPREQVST,orrespirest,numeric,type/Decimal,รหัสการหายใจของผู้ป่วย,,
OPREQVST,oriv,numeric,type/Decimal,1 = มี IV,,
OPREQVST,orcomplete,numeric,type/Decimal,รหัสสถานะสุดท้าย เมื่อออกจากห้องผ่าตัด,,
OPREQVST,oroutschd,numeric,type/Decimal,1 =ไม่กำหนดวันที่ผ่าตัด (ESTMDATE =NULL) : กรณีบันทึกจากหน้าจองคิวผ่าตัด,,
OPREQVST,staff,numeric,type/Decimal,รหัสแพทย์ผู้ผ่าตัด,,
OPREQVST,e,numeric,type/Decimal,ค่า E,,
OPREQVST,m,numeric,type/Decimal,ค่า M,,
OPREQVST,v,numeric,type/Decimal,ค่า V,,
OPREQVST,gcs,numeric,type/Decimal,ค่า GCS,,
OPREQVST,inodrug,varchar,type/Text,INODRUG,,
OPREQVST,underly,varchar,type/Text,UNDERLY,,
OPREQVST,curmed,varchar,type/Text,CURMED,,
OPREQVST,reqautoprint,numeric,type/Decimal,1 = REQAUTOPRINT,,
OPREQVST,pdcase,numeric,type/Decimal,1 = PDCASE,,
OPREQVST,abouttime,numeric,type/Decimal,ประมาณเวลาผ่าตัด (ชั่วโมง),,
OPREQVST,restriction,varchar,type/Text,ข้อจำกัดของผู้ป่วย,,
OPREQVST,icubook,numeric,type/Decimal,จอง I.C.U. (1 =  จอง I.C.U),,
OPREQVST,bloodreq,numeric,type/Decimal,ความต้องการสำรองเลือด (1 = ต้องการสำรองเลือด),,
OPREQVST,planadmit,numeric,type/Decimal,"Plan Admit (1 = Plan Admit , 2 = Un-plan Admit)",,
OPREQVST,precaution,numeric,type/Decimal,"(0 = Stardard , 1 = Precaution)",,
OPREQVST,biopsy,numeric,type/Decimal,ส่งชิ้นเนื้อ (1 = ส่งชิ้นเนื้อ),,
OPREQVST,preadmit,numeric,type/Decimal,Pre-Admission (1 = Pre-Admit),,
OPREQVST,addon,numeric,type/Decimal,"รหัส Add On (1 = Add On , NULL = Not Add On)",,
OPREQVST,aboutmin,numeric,type/Decimal,ประมาณเวลาผ่าตัด (นาที),,
OPREQVST,refreqdate,timestamp,type/DateTime,อ้างอิงวันที่ SETผ่าตัดเดิม,,
OPREQVST,refreqtime,numeric,type/Decimal,อ้างอิงเวลา SETผ่าตัดเดิม,,
OPREQVST,wardicu,numeric,type/Decimal,รหัส Ward ICU ที่จอง,,
OPREQVST,vstdate,timestamp,type/DateTime,วันที่มาตรวจ,,
OPREQVST,vsttime,numeric,type/Decimal,เวลามาตรวจ,,
OPREQVST,anticoag,numeric,type/Decimal,"Anticoagulant drug (1 = Yes, 2 = No)",,
OPREQVST,orderno,numeric,type/Decimal,เลขที่คำสั่งแพทย์,,
OPREQVST,onvent,numeric,type/Decimal,รหัส On Ventilator (1 = เลือก),,
OPREQVST,biopsydate,timestamp,type/DateTime,วันที่ต้องการ ถ้าเลือก Frozen (BIOPSY = 1),,
OPREQVST,biopsytime,numeric,type/Decimal,เวลาที่ต้องการ ถ้าเลือก Frozen (BIOPSY = 1),,
OPREQVST,frozentype,varchar,type/Text,ชนิดของ Specimens/organ,,
OPREQVST,frozenreq,varchar,type/Text,สิ่งที่ต้องการตรวจเพิ่มเติม,,
OPREQVST,frozencancel,numeric,type/Decimal,สถานะการยกเลิกจอง Frozen (1 = ยกเลิกจอง),,
OPREQVST,frozencanceldate,timestamp,type/DateTime,วันที่-เวลา ยกเลิกจอง Frozen,,
OPREQVST,frozenrcvdate,timestamp,type/DateTime,วันที่-เวลารับจอง/ปฏิเสธ Frozen จากห้องพยาธิ,,
OPREQVST,frozenrcvstf,numeric,type/Decimal,ผู้รับจอง/ปฏิเสธ Frozen จากห้องพยาธิ,,
OPREQVST,frozenst,numeric,type/Decimal,"สถานะการรับจอง Frozen (0 = รอรับจอง/ยกเลิกจอง, 1 = รับจองแล้ว, 2 = ปฏิเสธการรับจอง)",,
OPREQVST,frozennote,varchar,type/Text,หมายเหตุ/เหตุผลการปฏิเสธรับจอง Frozen,,
OPREQVST,presetdate,timestamp,type/DateTime,วันที่ยืนยันการจองผ่าตัด,,
OPREQVST,presettime,numeric,type/Decimal,เวลายืนยันการจองผ่าตัด,,
OPREQVST,presetstf,numeric,type/Decimal,รหัสผู้ยืนยันการจองผ่าตัด (ตาม User login),,
OPREQVST,lmpdate,timestamp,type/DateTime,วันที่ประวัติประจำเดือน,,
OPREQVST,addrflag,numeric,type/Decimal,Flag ข้อมูลที่ติดต่อได้ (1 = เลือก),,
OPREQVST,anticoagnote,varchar,type/Text,ระบุรายละเอียด Anticoagulant drug (ถ้าเลือก ANTICOAG : 1 =Yes),,
OPRTACT,oprtact,varchar,type/Text,รหัสกิจกรรม,,
OPRTACT,name_en,varchar,type/Text,ชื่อกิจกรรม (ภาษาอังกฤษ),,
OPRTACT,name,varchar,type/Text,ชื่อกิจกรรม,,
OPRTACT,income,varchar,type/Text,รหัสค่าใช้จ่าย,,
OPRTACT,maxamt,numeric,type/Decimal,ราคาไม่เกิน,,
OPRTACT,dftamt,numeric,type/Decimal,ราคา,,
OPRTACT,rfndamt,numeric,type/Decimal,เบิกได้,,
OPRTACT,minamt,numeric,type/Decimal,ราคาต่ำสุด,,
OPRTACT,spclty,numeric,type/Decimal,รหัสภาควิชา/สาขา,,
OPRTACT,otamt,numeric,type/Decimal,ราคานอกเวลา,,
OPRTACT,otrfndamt,numeric,type/Decimal,เบิกได้นอกเวลา,,
OPRTACT,icd9cm,varchar,type/Text,รหัส ICD9CM,,
OPRTACT,icd10tm,varchar,type/Text,รหัส ICD10TM,,
OPRTACT,oprttype,numeric,type/Decimal,รหัสประเภทหัตถการ,,
OPRTACT,cost,numeric,type/Decimal,ต้นทุน,,
OPRTACT,nhso,varchar,type/Text,รหัสเบิก สปสช.,,
OPRTACT,drgmx,varchar,type/Text,รหัส DRG,,
OPRTACT,csmbs,varchar,type/Text,รหัสเบิก กรมบัญชีกลาง,,
OPRTACT,sss,varchar,type/Text,รหัสเบิก ประกันสังคม,,
OPRTACT,var,varchar,type/Text,ตัวแปร,,
OPRTACT,minvalue,numeric,type/Decimal,จำนวนต่ำสุด,,
OPRTACT,maxvalue,numeric,type/Decimal,จำนวนสูงสุด,,
OPRTACT,dscper,numeric,type/Decimal,% ส่วนลด,,
OPRTACT,dscamt,numeric,type/Decimal,ราคาส่วนลด,,
OPRTACT,prfact,varchar,type/Text,ชุดรายการตรวจ,,
OPRTACT,sumprfamt,numeric,type/Decimal,ราคาตามชุดรายการตรวจ,,
OPRTACT,oprtgrp,numeric,type/Decimal,รหัสกลุ่มหัตถการ,,
OPRTACT,icdnum,numeric,type/Decimal,ICD Number,,
OPRTACT,icdtype,numeric,type/Decimal,ICD Type,,
OPRTACT,highcost,numeric,type/Decimal,1 = ค่าใช้จ่ายสูง,,
OPRTACT,major,numeric,type/Decimal,1 = Major,,
OPRTACT,dz8,varchar,type/Text,DZ8,,
OPRTACT,vac,varchar,type/Text,Vacine,,
OPRTACT,vcctype,varchar,type/Text,Vacine Type,,
OPRTACT,timemake,numeric,type/Decimal,เวลาทำหัตถการ,,
OPRTACT,validcode,numeric,type/Decimal,ตรวจสอบการใช้งาน,,
OPRTACT,datasource,numeric,type/Decimal,แหล่งที่มา,,
OPRTACT,incomeold,varchar,type/Text,รหัสค่าใช้จ่ายเก่า,,
OPRTACT,icd9cmadd1,varchar,type/Text,รหัส ICD9CM ตัวที่ 1,,
OPRTACT,icd9cmadd2,varchar,type/Text,รหัส ICD9CM ตัวที่ 2,,
OPRTACT,oprtactauto,numeric,type/Decimal,รหัสคิดเงินอัตโนมัติ,,
OPRTACT,perday,numeric,type/Decimal,1 = ราคาต่อวัน,,
OPRTACT,unit,varchar,type/Text,Unit,,
OPRTACT,note,varchar,type/Text,รายละเอียด,,
OPRTACT,oprtactgrp,numeric,type/Decimal,รหัสกลุ่มหัตถการ,,
OPRTACT,thtype,numeric,type/Decimal,THTYPE,,
OPRTACT,addper,numeric,type/Decimal,จำนวน%สำหรับคิดเงินเพิ่ม,,
OPRTACT,remflag,numeric,type/Decimal,Flag ให้ตรวจสอบว่าต้องระบุหมายเหตุสำหรับรหัสนี้,,
OPRTACT,nodefchk,numeric,type/Decimal,1 = ไม่ Default Check ว่า ทำ ในบันทึกหัตถการ,,
ORGANISM,organism,varchar,type/Text,,,
ORGANISM,code506,varchar,type/Text,,,
ORGANISM,codecom,varchar,type/Text,,,
ORGANISM,name,varchar,type/Text,,,
ORROOM,orroom,numeric,type/Decimal,รหัสห้องผ่าตัด,,
ORROOM,name,varchar,type/Text,ชื่อห้องผ่าตัด,,
ORROOM,var,varchar,type/Text,คำอ้างอิง,,
ORROOM,oplct,numeric,type/Decimal,,,
ORROOM,c_code,varchar,type/Text,,,
OVST,hn,varchar,type/Text,เลขที่ผู้ป่วยนอก,,
OVST,vstdate,timestamp,type/DateTime,วันที่ส่งตรวจ,,
OVST,vsttime,numeric,type/Decimal,เวลาส่งตรวจ,,
OVST,cliniclct,numeric,type/Decimal,รหัสหน่วยงานห้องตรวจ,,
OVST,an,varchar,type/Text,เลขที่ผู้ป่วยใน,,
OVST,vn,numeric,type/Decimal,VISIT NUMBER,,
OVST,fn,numeric,type/Decimal,เลขที่เชื่อมโยงในการค้นหาข้อมูล,,
OVST,dct,numeric,type/Decimal,รหัสแพทย์,,
OVST,findopd,numeric,type/Decimal,ค้นแฟ้ม,,
OVST,oldnew,numeric,type/Decimal,รหัส สถานะผู้ป่วยเก่าใหม่,,
OVST,ovstist,numeric,type/Decimal,รหัส สถานะการเข้ามา,,
OVST,ovstost,numeric,type/Decimal,รหัสสถานะสุดท้าย,,
OVST,rfrilct,numeric,type/Decimal,รหัสหน่วยงาน,,
OVST,rfrolct,numeric,type/Decimal,รหัสหน่วยงาน,,
OVST,rqtlab,numeric,type/Decimal,"ส่งlab null,1 = ส่งlab  2 = สั่งlabแล้ว",,
OVST,rqtrdo,numeric,type/Decimal,"ส่งรังสี null,1 = ส่งรังสี  2 = สั่งรังสีแล้ว",,
OVST,overtime,numeric,type/Decimal,นอกเวลา,,
OVST,emrgncy,numeric,type/Decimal,รหัส ระดับความรุนแรง,,
OVST,nextdate,timestamp,type/DateTime,วันที่นัด,,
OVST,nexttime,numeric,type/Decimal,เวลานัด,,
OVST,oappno,numeric,type/Decimal,เลขที่นัด,,
OVST,oldnewclinic,numeric,type/Decimal,OLDNEWCLINIC,,
OVST,dctnote,varchar,type/Text,doctor note,,
OVST,age,numeric,type/Decimal,อายุ,,
OVST,ageflag,varchar,type/Text,"อ้างอิง(ป=ปี,ด=เดือน,ว=วัน)",,
OVSTIST,ovstist,numeric,type/Decimal,รหัส สถานะการเข้ามา,,
OVSTIST,name,varchar,type/Text,ชื่อ,,
OVSTIST,name_en,varchar,type/Text,ชื่อสถานะเข้ารักษา (ภาษาอังกฤษ),,
OVSTOST,ovstost,numeric,type/Decimal,รหัส สถานะสุดท้าย,,
OVSTOST,name,varchar,type/Text,ชื่อ,,
OVSTOST,endvst,numeric,type/Decimal,จบการรักษา (=1),,
OVSTOST,var,varchar,type/Text,ตัวบ่งชี้,,
OVSTOST,endtreat,numeric,type/Decimal,"ตัวบ่งชี้สิ้นสุดการรักษา โดยที่ 0 or NULL=รักษา, 1=สิ้นสุด",,
OVSTOST,completecase,numeric,type/Decimal,1 = Complete,,
OVSTPRESS,hn,varchar,type/Text,เลขที่ผู้ป่วยนอก,,
OVSTPRESS,vstdate,timestamp,type/DateTime,วันที่ส่งตรวจ,,
OVSTPRESS,vsttime,numeric,type/Decimal,เวลาส่งตรวจ,,
OVSTPRESS,cliniclct,numeric,type/Decimal,รหัสหน่วยงานห้องตรวจ,,
OVSTPRESS,item,numeric,type/Decimal,ลำดับ,,
OVSTPRESS,vn,numeric,type/Decimal,Visit Number,,
OVSTPRESS,fn,numeric,type/Decimal,เลขที่เชื่อมโยงการค้นหาข้อมูล,,
OVSTPRESS,prdate,timestamp,type/DateTime,วันที่วัดความดัน,,
OVSTPRESS,prtime,numeric,type/Decimal,เวลาที่วัดความดัน,,
OVSTPRESS,an,varchar,type/Text,เลขที่ผู้ป่วยใน,,
OVSTPRESS,lbpn,numeric,type/Decimal,ความดันต่ำ,,
OVSTPRESS,hbpn,numeric,type/Decimal,ความดันสูง,,
OVSTPRESS,pr,numeric,type/Decimal,อัตราการเต้นชีพจร,,
OVSTPRESS,rr,numeric,type/Decimal,อัตราการหายใจ,,
OVSTPRESS,bt,numeric,type/Decimal,อุณหภูมิร่างกาย,,
OVSTPRESS,o2sat,numeric,type/Decimal,O2Sat,,
OVSTPRESS,hct,numeric,type/Decimal,ความเข้มเม็ดเลือดแดง,,
OVSTPRESS,dtx,numeric,type/Decimal,ระดับน้ำตาลในเลือด,,
OVSTPRESS,ps,numeric,type/Decimal,ระดับความรู้สึกปวด,,
OVSTPRESS,note,varchar,type/Text,รายละเอียด,,
OVSTPRESS,weight,numeric,type/Decimal,น้ำหนัก,,
OVSTPRESS,height,numeric,type/Decimal,ส่วนสูง,,
OVSTPRESS,headline,numeric,type/Decimal,เส้นรอบศีรษะ,,
OVSTPRESS,ps2,numeric,type/Decimal,Pain Score,,
OVSTPRESS,emrgncy,numeric,type/Decimal,ระดับความรุนแรง,,
OVSTPRESS,zonelct,numeric,type/Decimal,รหัสโซน,,
OVSTPRESS,roomno,numeric,type/Decimal,เลขที่เตียง,,
OVSTPRESS,e,varchar,type/Text,E,,
OVSTPRESS,m,varchar,type/Text,M,,
OVSTPRESS,v,varchar,type/Text,V,,
PAIDST,paidst,numeric,type/Decimal,รหัสสถานะจ่ายเงิน,,
PAIDST,name,varchar,type/Text,ชื่อสถานะจ่ายเงิน,,
PAIDST,var,varchar,type/Text,ตัวแปร,,
