table_name,column_name,database_type,base_type,comment,,
IPTBOOKBEDICUHST,bt,numeric,type/Decimal,e. Vital signs (BT),,
IPTBOOKBEDICUHST,bp1,numeric,type/Decimal,e. Vital signs (SBP),,
IPTBOOKBEDICUHST,bp2,numeric,type/Decimal,e. Vital signs (DBP),,
IPTBOOKBEDICUHST,map,numeric,type/Decimal,"ค่า MAP เกิดจากคำนวณ [ROUND( (BP2 + 1/3*(BP1 - BP2) ) , 2) หรือ ROUND( (BP1  + (2*BP2) )/3 , 2) ] [ มี Function GET_MAP(BP1, BP2) ]",,
IPTBOOKBEDICUHST,pr,numeric,type/Decimal,e. Vital signs (PR),,
IPTBOOKBEDICUHST,rr,numeric,type/Decimal,e. Vital signs (RR),,
IPTBOOKBEDICUHST,sp02,numeric,type/Decimal,e. Vital signs (SpO2),,
IPTBOOKBEDICUHST,eyeopen,numeric,type/Decimal,d. Neuro condition(GCS : Eye Opening(E) ; IPTEYEOPEN.EYEOPEN),,
IPTBOOKBEDICUHST,verbalresp,numeric,type/Decimal,d. Neuro condition(GCS : Verbal Response(V) ; IPTVERBALRESP.VERBALRESP),,
IPTBOOKBEDICUHST,mortorresp,numeric,type/Decimal,d. Neuro condition(GCS : Mortor Response(M) ; IPTMORTORRESP.MORTORRESP),,
IPTBOOKBEDICUHST,labresult1,varchar,type/Text,7. Lab Result : Platelets,,
IPTBOOKBEDICUHST,labresult2,varchar,type/Text,Lab Result : Bilirubin,,
IPTBOOKBEDICUHST,labresult3,varchar,type/Text,Lab Result : Creatinine,,
IPTBOOKBEDICUHST,urineout,varchar,type/Text,"Urine output, mL per day",,
IPTBOOKBEDICUHST,sys1score,numeric,type/Decimal,"System: Respiration ; PaO2/FiO2 [ 0 : >=400, 1 : <400(300-399), 2 : <300(200-299), 3 : <200(100-199) with respiratory support, 4 : <100 with respiratory support ]",,
IPTBOOKBEDICUHST,sys2score,numeric,type/Decimal,"System: Coagulation ; Plateles  [ 0 : >=150, 1 : <150(100-149), 2 : <100(50-99), 3 : <50(20-49), 4 : <20 ]",,
IPTBOOKBEDICUHST,sys3score,numeric,type/Decimal,"System: Liver ; Bilirubin [ 0 : <1.2(<20), 1 : 1.2-1.9(20-32), 2 : 2.0-5.9(33-101), 6.0-11.9(102-204), >=120(>204) ]",,
IPTBOOKBEDICUHST,sys4score,numeric,type/Decimal,"Cardiovascular [ 0 : MAP>=70 mmHg, 1 : MAP<70 mmHg, 3 : Dopamine<=5 or dobutamine (any dose), 4 : Dopamine 5.1-15 or epinephrine <=0.1 or norepinephrine <=0.1, 5 : Dopamine >15 or epinephrine >0.1 or norepinephrine >0.1]",,
IPTBOOKBEDICUHST,sys5score,numeric,type/Decimal,"Central Nervous System (CNS); Glasgow Coma Scale score (เอาค่ามาจากช่อง Total ที่ Page ข้อมูลทางคลินิก(1) : GCS) [ 0 : 15 , 1 : 13-14, 2 : 10-12, 3 : 6-9, 4 : <6 ]",,
IPTBOOKBEDICUHST,sys6score,numeric,type/Decimal,"Renal ; Creatinine or Urine output [ 0 : <1.2(<110), 1 : 1.2-1.9(110-170), 2 : 2.0-3.4(299), 3 : 3.5-4.9(300-400) or UOP<500, 4 : >5.0(>440) or UOP<200 ]",,
IPTBOOKBEDICUHST,sofascore,numeric,type/Decimal,ค่า SOFA Score (ผลรวมคะแนน = SYS1SCORE + SYS2SCORE + SYS3SCORE + SYS4SCORE + SYS5SCORE + SYS6SCORE),,
IPTINFANTMOTHER,an,varchar,type/Text,เลขที่ผู้ป่วยใน ของแม่,,
IPTINFANTMOTHER,nbflag,varchar,type/Text,ตัวระบุเป็น New born,,
IPTINFANTMOTHER,hn,varchar,type/Text,เลขที่ผู้ป่วยนอก ของลูก,,
IPTINFANTMOTHER,delrequest,numeric,type/Decimal,เลขที่รับไว้,,
IPTINFANTMOTHER,delseq,numeric,type/Decimal,ลำดับที่ในการคลอดครั้งนี้,,
IPTINFANTMOTHER,wristyearmonth,numeric,type/Decimal,ปี/เดือน ของหมายเลขข้อมือเด็ก,,
IPTINFANTMOTHER,wristno,numeric,type/Decimal,หมายเลขข้อมือเด็ก (หมายเลขการคลอด),,
IPTINFANTMOTHER,aninfant,varchar,type/Text,AN ลูก,,
IPTINFANTMOTHER,infsickflag,varchar,type/Text,รหัสสถานะเด็กป่วย,,
IPTSUMDCT,an,varchar,type/Text,หมายเลขประจำตัวผู้ป่วยใน,,
IPTSUMDCT,hn,varchar,type/Text,เลขที่ผู้ป่วยนอก,,
IPTSUMDCT,birthorder,numeric,type/Decimal,ลำดับที่ในการคลอด,,
IPTSUMDCT,motheran,varchar,type/Text,หมายเลขประจำตัวผู้ป่วยในของมารดา,,
IPTSUMDCT,spclty,numeric,type/Decimal,รหัสภาควิชา/สาขา,,
IPTSUMDCT,ward,numeric,type/Decimal,รหัสหอผู้ป่วย,,
IPTSUMDCT,indate,timestamp,type/DateTime,วันที่ลงทะเบียนผู้ป่วยใน,,
IPTSUMDCT,intime,numeric,type/Decimal,เวลาลงทะเบียนผู้ป่วยใน,,
IPTSUMDCT,dchdate,timestamp,type/DateTime,วันที่จำหน่ายผู้ป่วย,,
IPTSUMDCT,dchtime,numeric,type/Decimal,เวลาจำหน่ายผู้ป่วย,,
IPTSUMDCT,dentdct,numeric,type/Decimal,แพทย์ Resident,,
IPTSUMDCT,staffdct,numeric,type/Decimal,แพทย์ Staff,,
IPTSUMDCT,dchst,numeric,type/Decimal,รหัสสถานะการจำหน่ายผู้ป่วยใน,,
IPTSUMDCT,dchtype,numeric,type/Decimal,รหัสประเภทการจำหน่ายผู้ป่วยใน,,
IPTSUMDCT,iptsumtype,numeric,type/Decimal,รหัสประเภทสรุปผู้ป่วย,,
IPTSUMDCT,completeflag,numeric,type/Decimal,ตัวบ่งชี้การสรุปผลข้อมูล (1 = เรียบร้อยแล้ว),,
IPTSUMDCT,gravidity,numeric,type/Decimal,จำนวนครั้งของการตั้งครรภ์,,
IPTSUMDCT,parity,numeric,type/Decimal,จำนวนครรภ์ที่คลอด,,
IPTSUMDCT,livchild,numeric,type/Decimal,จำนวนบุตรที่มีชีวิตอยู่ (Living Children),,
IPTSUMDCT,noanc,numeric,type/Decimal,จำนวนการฝากครรภ์,,
IPTSUMDCT,vdrltest,numeric,type/Decimal,รหัสผลการตรวจ VDRL,,
IPTSUMDCT,tphatest,numeric,type/Decimal,รหัสผลการตรวจ TPHA,,
IPTSUMDCT,hbsagtest,numeric,type/Decimal,รหัสผลการตรวจ Hbsag,,
IPTSUMDCT,gestation,numeric,type/Decimal,ระยะเวลาตั้งครรภ์ (หน่วยเป็นสัปดาห์),,
IPTSUMDCT,normaldelivery,numeric,type/Decimal,ตัวบ่งชี้ว่าคลอดปกติ (1=คลอดปกติ),,
IPTSUMDCT,perinealtear,numeric,type/Decimal,รหัสขนาดของฝีเย็บ (Perineal Tear),,
IPTSUMDCT,mucosatear,numeric,type/Decimal,ลักษณะรอยฉีกขาดของช่องคลอด (Mucosa) (1=มีรอยฉีกขาด),,
IPTSUMDCT,fornixtear,numeric,type/Decimal,ลักษณะรอยฉีกขาดของช่องคลอด (Fornix) (1=มีรอยฉีกขาด),,
IPTSUMDCT,cervixtear,numeric,type/Decimal,ลักษณะรอยฉีกขาดของช่องคลอด (Cervix) (1=มีรอยฉีกขาด),,
IPTSUMDCT,rectaltear,numeric,type/Decimal,ลักษณะรอยฉีกขาดของช่องคลอด (Rectal) (1=มีรอยฉีกขาด),,
IPTSUMDCT,episiotomyflag,numeric,type/Decimal,ตัวบ่งชี้ว่ามีการตัด (1=มีผ่าตัด),,
IPTSUMDCT,tubalflag,numeric,type/Decimal,ตัวบ่งชี้ว่ามีการทำหมัน (1=ทำหมัน),,
IPTSUMDCT,obsposition,numeric,type/Decimal,รหัสท่าที่ใช้ในการคลอด,,
IPTSUMDCT,labortype,numeric,type/Decimal,รหัสวิธีการเจ็บครรภ์,,
IPTSUMDCT,labdataflag,numeric,type/Decimal,ตัวบ่งชี้ว่าแพทย์มีการบันทึกผล Lab (1=บันทึก),,
IPTSUMDCT,diagdeath,varchar,type/Text,รหัสโรคที่เป็นสาเหตุการเสียชีวิต (ICD-10),,
IPTSUMDCT,obsadmittype,numeric,type/Decimal,สถานภาพผู้ป่วยคลอด ก่อนรับเป็นผู้ป่วยใน,,
IPTSUMDCT,obsdchtype,numeric,type/Decimal,สถานภาพผู้ป่วยคลอด หลังจากการจำหน่าย,,
IPTSUMDCT,numberinfant,numeric,type/Decimal,จำนวนเด็กที่คลอดในการคลอดหนึ่งครั้ง,,
IPTSUMDCT,placedelivery,numeric,type/Decimal,รหัสสถานที่เกิดของเด็ก,,
IPTSUMDCT,hntnlty,numeric,type/Decimal,รหัสสัญชาติของสามี,,
IPTSUMDCT,fntnlty,numeric,type/Decimal,รหัสสัญชาติของบิดา,,
IPTSUMDCT,mntnlty,numeric,type/Decimal,รหัสสัญชาติของมารดา,,
IPTSUMDCT,male,numeric,type/Decimal,รหัสเพศ,,
IPTSUMDCT,weight,numeric,type/Decimal,น้ำหนักของเด็ก (หน่วยเป็นกรัม),,
IPTSUMDCT,infbirthtype,numeric,type/Decimal,รหัสลักษณะการเกิด,,
IPTSUMDCT,infdchtype,numeric,type/Decimal,รหัสการจำหน่ายเด็กแรกเกิด,,
IPTSUMDCT,clinically,numeric,type/Decimal,รหัสลักษณะของเด็กแรกเกิด,,
IPTSUMDCT,drg,numeric,type/Decimal,DRG,,
IPTSUMDCT,rw,numeric,type/Decimal,RW,,
IPTSUMDCT,adjrw,numeric,type/Decimal,AdjRw,,
IPTSUMDCT,drgrate,numeric,type/Decimal,อัตราการคำนวณ DRG,,
IPTSUMDCT,mdc,varchar,type/Text,MDC,,
IPTSUMDCT,err,numeric,type/Decimal,ERR,,
IPTSUMDCT,warn,numeric,type/Decimal,WARN,,
IPTSUMDCT,result,varchar,type/Text,RESULT,,
IPTSUMDCT,ot,numeric,type/Decimal,OT,,
IPTSUMDCT,wtlos,numeric,type/Decimal,WTLOS,,
IPTSUMDCT,drgversion,varchar,type/Text,คำนวณ DRG Version,,
IPTSUMDIAG,an,varchar,type/Text,หมายเลขประจำตัวผู้ป่วยใน,,
IPTSUMDIAG,diagorder,numeric,type/Decimal,ลำดับที่ของข้อมูล,,
IPTSUMDIAG,diagtype,numeric,type/Decimal,รหัสความสำคัญของโรค,,
IPTSUMDIAG,itemno,numeric,type/Decimal,ลำดับ,,
IPTSUMDIAG,icd10,varchar,type/Text,รหัส ICD10,,
IPTSUMDIAG,diagexttype,numeric,type/Decimal,รหัสประเภทของข้อมูล External Cause,,
IPTSUMDIAG,spclty,numeric,type/Decimal,รหัสภาควิชา/สาขา,,
IPTSUMMARY,an,varchar,type/Text,หมายเลขประจำตัวผู้ป่วยใน,,
IPTSUMMARY,hn,varchar,type/Text,เลขที่ผู้ป่วยนอก,,
IPTSUMMARY,birthorder,numeric,type/Decimal,ลำดับที่ในการคลอด,,
IPTSUMMARY,times,numeric,type/Decimal,ครั้งที่ Admit,,
IPTSUMMARY,iptsumtype,numeric,type/Decimal,รหัสประเภทสรุปผู้ป่วย,,
IPTSUMMARY,motheran,numeric,type/Decimal,หมายเลขประจำตัวผู้ป่วยในของมารดา,,
IPTSUMMARY,dentdct,numeric,type/Decimal,แพทย์ Resident,,
IPTSUMMARY,staffdct,numeric,type/Decimal,แพทย์ Staff,,
IPTSUMMARY,indate,timestamp,type/DateTime,วันที่ลงทะเบียนผู้ป่วยใน,,
IPTSUMMARY,intime,numeric,type/Decimal,เวลาลงทะเบียนผู้ป่วยใน,,
IPTSUMMARY,dchdate,timestamp,type/DateTime,วันที่จำหน่ายผู้ป่วย,,
IPTSUMMARY,dchtime,numeric,type/Decimal,เวลาจำหน่ายผู้ป่วย,,
IPTSUMMARY,ageadm,numeric,type/Decimal,อายุขณะที่รับเป็นผู้ป่วยใน,,
IPTSUMMARY,ageadmflag,varchar,type/Text,"หน่วยของอายุขณะที่รับ (ว = วัน , ด = เดือน , ป = ปี)",,
IPTSUMMARY,agedisc,numeric,type/Decimal,อายุขณะที่ทำการจำหน่ายผู้ป่วยใน,,
IPTSUMMARY,agediscflag,varchar,type/Text,"หน่วยของอายุขณะที่จำหน่าย (ว = วัน , ด = เดือน , ป = ปี)",,
IPTSUMMARY,dlos,numeric,type/Decimal,จำนวนวันที่ผู้ป่วยพักรักษาในโรงพยาบาล,,
IPTSUMMARY,hlos,numeric,type/Decimal,จำนวนชั่วโมงที่ผู้ป่วยพักรักษาในโรงพยาบาล,,
IPTSUMMARY,dchtype,numeric,type/Decimal,รหัสประเภทการจำหน่ายผู้ป่วยใน,,
IPTSUMMARY,dchst,numeric,type/Decimal,รหัสสถานะการจำหน่ายผู้ป่วยใน,,
IPTSUMMARY,diagdeath,varchar,type/Text,รหัสโรคที่เป็นสาเหตุการเสียชีวิต (ICD-10),,
IPTSUMMARY,spclty,numeric,type/Decimal,รหัสภาควิชา/สาขา,,
IPTSUMMARY,ward,numeric,type/Decimal,รหัสหอผู้ป่วย,,
IPTSUMMARY,gravidity,numeric,type/Decimal,จำนวนครั้งของการตั้งครรภ์,,
IPTSUMMARY,parity,numeric,type/Decimal,จำนวนครรภ์ที่คลอด,,
IPTSUMMARY,livchild,numeric,type/Decimal,จำนวนบุตรที่มีชีวิตอยู่ (Living Children),,
IPTSUMMARY,numberinfant,numeric,type/Decimal,จำนวนเด็กที่คลอดในการคลอดหนึ่งครั้ง,,
IPTSUMMARY,numberbh,numeric,type/Decimal,จำนวนเด็กที่เกิดในโรงพยาบาล,,
IPTSUMMARY,vdrltest,numeric,type/Decimal,รหัสผลการตรวจ VDRL,,
IPTSUMMARY,tphatest,numeric,type/Decimal,รหัสผลการตรวจ TPHA,,
IPTSUMMARY,hbsagtest,numeric,type/Decimal,รหัสผลการตรวจ Hbsag,,
IPTSUMMARY,precautionflag,numeric,type/Decimal,ตัวบ่งชี้ว่าเป็นผู้ป่วย Precaution,,
IPTSUMMARY,obsadmittype,numeric,type/Decimal,สถานภาพผู้ป่วยคลอด ก่อนรับเป็นผู้ป่วยใน,,
IPTSUMMARY,obsdchtype,numeric,type/Decimal,สถานภาพผู้ป่วยคลอด หลังจากการจำหน่าย,,
IPTSUMMARY,placedelivery,numeric,type/Decimal,รหัสสถานที่เกิดของเด็ก,,
IPTSUMMARY,infbirthtype,numeric,type/Decimal,รหัสลักษณะการเกิด,,
IPTSUMMARY,infdchtype,numeric,type/Decimal,รหัสการจำหน่ายเด็กแรกเกิด,,
IPTSUMMARY,clinically,numeric,type/Decimal,รหัสลักษณะของเด็กแรกเกิด,,
IPTSUMMARY,obsposition,numeric,type/Decimal,รหัสท่าที่ใช้ในการคลอด,,
IPTSUMMARY,labortype,numeric,type/Decimal,รหัสวิธีการเจ็บครรภ์,,
IPTSUMMARY,perinealtear,numeric,type/Decimal,รหัสขนาดของฝีเย็บ (Perineal Tear),,
IPTSUMMARY,mucosatear,numeric,type/Decimal,ลักษณะรอยฉีกขาดของช่องคลอด (Mucosa) (1=มีรอยฉีกขาด),,
IPTSUMMARY,fornixtear,numeric,type/Decimal,ลักษณะรอยฉีกขาดของช่องคลอด (Fornix) (1=มีรอยฉีกขาด),,
IPTSUMMARY,cervixtear,numeric,type/Decimal,ลักษณะรอยฉีกขาดของช่องคลอด (Cervix) (1=มีรอยฉีกขาด),,
IPTSUMMARY,rectaltear,numeric,type/Decimal,ลักษณะรอยฉีกขาดของช่องคลอด (Rectal) (1=มีรอยฉีกขาด),,
IPTSUMMARY,episiotomyflag,numeric,type/Decimal,ตัวบ่งชี้ว่ามีการตัด (1=มีผ่าตัด),,
IPTSUMMARY,tubalflag,numeric,type/Decimal,ตัวบ่งชี้ว่ามีการทำหมัน (1=ทำหมัน),,
IPTSUMMARY,anc,numeric,type/Decimal,ตัวบ่งชี้ว่าผู้ป่วยมีการฝากครรภ์,,
IPTSUMMARY,noanc,numeric,type/Decimal,จำนวนการฝากครรภ์,,
IPTSUMMARY,normaldelivery,numeric,type/Decimal,ตัวบ่งชี้ว่าคลอดปกติ,,
IPTSUMMARY,gestation,numeric,type/Decimal,ระยะเวลาตั้งครรภ์ (หน่วยเป็นสัปดาห์),,
IPTSUMMARY,drg,numeric,type/Decimal,DRG,,
IPTSUMMARY,rw,numeric,type/Decimal,RW,,
IPTSUMMARY,adjrw,numeric,type/Decimal,AdjRw,,
IPTSUMMARY,drgrate,numeric,type/Decimal,อัตราการคำนวณ DRG,,
IPTSUMMARY,mdc,varchar,type/Text,MDC,,
IPTSUMMARY,err,numeric,type/Decimal,ERR,,
IPTSUMMARY,warn,numeric,type/Decimal,WARN,,
IPTSUMMARY,result,varchar,type/Text,RESULT,,
IPTSUMMARY,ot,numeric,type/Decimal,OT,,
IPTSUMMARY,wtlos,numeric,type/Decimal,WTLOS,,
IPTSUMMARY,drgversion,varchar,type/Text,คำนวณ DRG Version,,
IPTSUMMARY,auditstf,numeric,type/Decimal,ผู้ที่ AUDIT,,
IPTSUMMARY,auditdate,timestamp,type/DateTime,วันที่ AUDIT,,
IPTSUMMARY,audittime,numeric,type/Decimal,เวลาที่ AUDIT,,
IPTSUMOPRT,an,varchar,type/Text,หมายเลขประจำตัวผู้ป่วยใน,,
IPTSUMOPRT,diagorder,numeric,type/Decimal,ลำดับที่ของข้อมูล,,
IPTSUMOPRT,itemno,numeric,type/Decimal,ลำดับ,,
IPTSUMOPRT,icd9cm,varchar,type/Text,รหัส ICD9CM,,
IPTSUMOPRT,oprtpst,numeric,type/Decimal,ตำแหน่งที่ทำหัตถการ,,
IPTSUMOPRT,oprtcnt,numeric,type/Decimal,ครั้งที่ทำหัตถการ,,
IPTSUMOPRT,oprtside,numeric,type/Decimal,"รหัสตำแหน่งของอวัยวะที่ผ่าตัด
null = ไม่มี
L = Left
R = Right
B = Both",,
IPTSUMOPRT,oprtstf,numeric,type/Decimal,รหัสผู้ทำหัตถการ,,
IPTSUMOPRT,orflag,numeric,type/Decimal,"หัตถการห้องผ่าตัด
null = ไม่ระบุ
0 = ไม่ใช่หัตถการห้องผ่าตัด
1 = หัตถการห้องผ่าตัด",,
IPTSUMOPRT,sndout,numeric,type/Decimal,"ส่งนอก รพ. (1 = ส่งนอก รพ.)
null = ไม่ระบุ
0 = ใน รพ.
1 = ส่งนอก รพ.",,
IPTSUMOPRT,indate,timestamp,type/DateTime,วันที่เริ่มทำหัตถการ,,
IPTSUMOPRT,intime,numeric,type/Decimal,เวลาที่เริ่มทำหัตถการ,,
IPTSUMOPRT,outdate,timestamp,type/DateTime,วันที่ผ่าตัดเสร็จ,,
IPTSUMOPRT,outtime,numeric,type/Decimal,เวลาที่ผ่าตัดเสร็จ,,
ISPMCREC,ispmcrecno,numeric,type/Decimal,เลขที่ลงทะเบียนรับ,,
ISPMCREC,ispmcrecdate,timestamp,type/DateTime,วันที่ลงทะเบียน,,
ISPMCREC,ispmclct,numeric,type/Decimal,รหัสของหน่วยงานงานที่ส่งซ่อม,,
ISPMCREC,ispgrp,numeric,type/Decimal,รหัสประเภท,,
ISPMCREC,isptype,numeric,type/Decimal,รหัสชื่อเครื่องมือแพทย์,,
ISPMCREC,ispbrand,numeric,type/Decimal,รหัสยี่ห้อ,,
ISPMCREC,model,varchar,type/Text,รุ่น,,
ISPMCREC,design,varchar,type/Text,แบบ,,
ISPMCREC,feature,varchar,type/Text,คุณลักษณะ,,
ISPMCREC,sno,varchar,type/Text,เลขที่ใบตรวจรับ,,
ISPMCREC,appno,varchar,type/Text,เลขที่ขอซื้อ/จ้าง,,
ISPMCREC,qty,numeric,type/Decimal,จำนวนสั่งซื้อ,,
ISPMCREC,ispunit,numeric,type/Decimal,หน่วย(view ispunit),,
ISPMCREC,price,numeric,type/Decimal,ราคา/หน่วย,,
ISPMCREC,tprice,numeric,type/Decimal,ราคารวม,,
ISPMCREC,orddate,timestamp,type/DateTime,วันที่ขอซื้อ/จ้าง,,
ISPMCREC,recdate,timestamp,type/DateTime,วันที่ตรวจรับ,,
ISPMCREC,yearbudget,numeric,type/Decimal,ปีงบประมาณ,,
ISPMCREC,ispbudget,numeric,type/Decimal,รหัสประเภทงบประมาณ,,
ISPMCREC,insureyear,numeric,type/Decimal,การรับประกัน(ปี),,
ISPMCREC,insuredate,timestamp,type/DateTime,วันที่สิ้นสุดรับประกัน,,
ISPMCREC,mtdget,numeric,type/Decimal,วิธีการได้มา 1=จัดซื้อ 2=บริจาค 3=แถมฟรี,,
ISPMCREC,madate,timestamp,type/DateTime,วันที่ ma,,
ISPMCREC,pano,varchar,type/Text,pa,,
ISPMCREC,pono,varchar,type/Text,po ไม่ใช้  ใช้ appno,,
ISPMCREC,cnno,varchar,type/Text,cn ไม่ใช้  ใช้ appno,,
ISPMCREC,chkinsure,numeric,type/Decimal,1= รับประกันตลอดอายุการใช้งาน,,
ISPMCREC,remark,varchar,type/Text,หมายเหตุ,,
ISPMCREC,mainst,numeric,type/Decimal,เครื่องหลัก =1 /เครื่องย่อย=2,,
ISPMCREC,mispmcrecno,numeric,type/Decimal,เลขลงทะเบียนเครื่องหลัก,,
ISPTYPE,isptype,numeric,type/Decimal,รหัสชื่อเครื่องมือแพทย์,,
ISPTYPE,nameeng,varchar,type/Text,ชื่อเครื่องมือแพทย์ eng,,
ISPTYPE,nametha,varchar,type/Text,ชื่อเครื่องมือแพทย์ไทย,,
ISPTYPE,var,varchar,type/Text,รหัสดัชนี,,
ISPTYPE,ispgrp,numeric,type/Decimal,รหัสประเภท,,
ISPTYPE,durable_code,varchar,type/Text,รหัสเดิม,,
ISPTYPE,ispunit,numeric,type/Decimal,หน่วย,,
ISPUSEMC,hn,varchar,type/Text,รหัสผู้ป่วย,,
ISPUSEMC,ispusedate,timestamp,type/DateTime,วันที่เปิด,,
ISPUSEMC,isplct,numeric,type/Decimal,หน่วยงาน,,
ISPUSEMC,ispusetime,numeric,type/Decimal,เวลาที่เปิด,,
ISPUSEMC,an,varchar,type/Text,เก็บผู้ป่วยใน (ipt),,
ISPUSEMC,isptype,numeric,type/Decimal,รหัสชื่อเครื่องมือแพทย์,,
ISPUSEMC,ispmcrecno,numeric,type/Decimal,เลขที่ลงทะเบียนรับ,,
ISPUSEMC,mccode,numeric,type/Decimal,รหัสเครื่อง,,
ISPUSEMC,itemno,numeric,type/Decimal,ลำดับ,,
ISPUSEMC,ispenddate,timestamp,type/DateTime,วันที่ปิด,,
ISPUSEMC,ispendtime,numeric,type/Decimal,เวลาที่ปิด,,
ISPUSEMC,ispuseqty,numeric,type/Decimal,จำนวนการใช้งาน,,
ISPUSEMC,salerate,numeric,type/Decimal,ราคาปกติ salerate,,
ISPUSEMC,ispuseamt,numeric,type/Decimal,มูลค่าการใช้งาน,,
ISPUSEMC,rfndamt,numeric,type/Decimal,ราคาที่เบิกได้,,
ISPUSEMC,recuseflag,numeric,type/Decimal,(ยืนยันการใช้การเครื่องมือ)1=ปิดเครื่อง(Y)  0 =เปิดเครื่อง,,
ISPUSEMC,finlct,numeric,type/Decimal,จุดคิดเงิน,,
ISPUSEMC,finrefno,numeric,type/Decimal,เลขอ้างอิง,,
ISPUSEMC,ordercode,numeric,type/Decimal,v.ispmasterorder,,
ISPUSEMC,income,varchar,type/Text,รหัสค่าใช้จ่าย,,
ISPUSEMC,vstdate,timestamp,type/DateTime,"ผู้ป่วยนอกจาก ovst.vstdate,t.ipt.indate",,
ISPUSEMC,vsttime,numeric,type/Decimal,"ผู้ป่วยนอกจาก  ovst.vsttime,t.ipt.intime",,
ISPUSEMC,cliniclct,numeric,type/Decimal,"เก็บ ward หน่วยงาน คลินิก จาก ผู้ป่วยนอก(ovst),ผู้ป่วยใน(ipt)",,
ISPUSEMC,computername,varchar,type/Text,ชื่อเครื่อง,,
ISPUSEMC,assambly,varchar,type/Text,รหัสเครื่องบันทึก,,
ISPUSEMC,computerlct,numeric,type/Decimal,รหัสหน่วยงานเครื่องที่บันทึก,,
ISPUSEMC,pttype,numeric,type/Decimal,รหัสกลุ่มสิทธิ์,,
ISPUSEMC,prvno,numeric,type/Decimal,ลำดับสิทธิ์,,
ISPUSEMC,pttypeext,varchar,type/Text,รหัสสิทธิ์,,
ISPUSEMC,ldateflag,numeric,type/Decimal,วันย้อนหลัง,,
ISPUSEMC,canceltext,varchar,type/Text,หมายเหตุ,,
LABEXM,labexm,numeric,type/Decimal,รหัสรายการตรวจ,,
LABEXM,labgrp,numeric,type/Decimal,รหัสประเภทการตรวจ,,
LABEXM,labgrptype,numeric,type/Decimal,รหัสประเภทกลุ่มการตรวจ,,
LABEXM,name,varchar,type/Text,ชื่อรายการตรวจ,,
LABEXM,hcode,varchar,type/Text,รหัสเดิม รพ.,,
LABEXM,abbrname,varchar,type/Text,ชื่อย่อ,,
LABEXM,name_en,varchar,type/Text,,,
LABEXM,minnrm,varchar,type/Text,ค่าพิกัด(Normal Range) ต่ำสุด,,
LABEXM,maxnrm,varchar,type/Text,ค่าพิกัด(Normal Range) สูงสุด,,
LABEXM,nrmunit,varchar,type/Text,หน่วยของพิกัด,,
